{
  "tenantId": "smh-dental",
  "routeId": "treatments.3d-mouth-guards",
  "pageType": "treatment",
  "version": "1.0.0",
  "sections": [
    {
      "instanceId": "3d-mouth-guards-hero",
      "componentId": "treatment.heroIntro",
      "variantId": "smh_3d_mouth_guards_hero",
      "order": 10,
      "seoRole": "hero",
      "eyebrow": "3D mouth guards",
      "title": "3D printed mouth guards in Shoreham-by-Sea",
      "body": "Digital scans and design produce guards that balance comfort, retention, and protection for sport or grinding.",
      "bullets": [
        "Comfort-first fit from intraoral scans",
        "Custom thickness mapped to your needs",
        "Smooth finishes to protect cheeks and gums",
        "Designed with clinician oversight"
      ],
      "ctas": [
        { "label": "Book a guard consult", "href": "/contact", "preset": "primary" },
        { "label": "Ask about 3D guards", "href": "/contact?topic=3d-printing", "preset": "secondary" }
      ]
    },
    {
      "instanceId": "3d-mouth-guards-trust",
      "componentId": "treatment.trustSignals",
      "variantId": "smh_3d_mouth_guards_trust",
      "order": 20,
      "seoRole": "supporting",
      "eyebrow": "Why patients prefer our guards",
      "title": "Comfort, retention, and review",
      "items": [
        "Digital scans avoid messy impressions",
        "Design tuned to sport or bruxism needs",
        "Edges and thickness smoothed for comfort",
        "Fit checked by the treating clinician",
        "Adjustment and remake supported by stored files"
      ]
    },
    {
      "instanceId": "3d-mouth-guards-overview",
      "componentId": "treatment.consultationOverview",
      "variantId": "smh_3d_mouth_guards_overview",
      "order": 30,
      "seoRole": "primaryContent",
      "eyebrow": "What they are",
      "title": "Digitally designed guards for predictable protection",
      "body": "We scan your teeth, design the guard to match your bite and protection needs, and print it in-house. Designs stay on file, making adjustments or replacements straightforward.",
      "bullets": [
        "Intraoral scan captures the detail we need",
        "Design shaped to distribute forces evenly",
        "Printed guard finished for smooth edges",
        "Fit appointment with bite checks",
        "Replacement or backup guards derived from your file"
      ]
    },
    {
      "instanceId": "3d-mouth-guards-who",
      "componentId": "treatment.whoIsItFor",
      "variantId": "smh_3d_mouth_guards_who",
      "order": 40,
      "seoRole": "primaryContent",
      "eyebrow": "Who it helps",
      "title": "Built around your activity and bite",
      "items": [
        "Athletes wanting a slim, protective fit",
        "Patients grinding or clenching who need night guards",
        "People with gag reflexes who prefer scan-led records",
        "Those needing replacements without repeated impressions",
        "Patients who want clear guidance on wear and care"
      ]
    },
    {
      "instanceId": "3d-mouth-guards-process",
      "componentId": "treatment.processTimeline",
      "variantId": "smh_3d_mouth_guards_process",
      "order": 50,
      "seoRole": "primaryContent",
      "eyebrow": "Your pathway",
      "title": "From scan to smooth fit",
      "items": [
        "Consultation and scan",
        "Design for coverage, thickness, and comfort",
        "In-house print and finishing",
        "Fit appointment with bite and retention checks",
        "Care guidance and storage tips",
        "Optional backups printed from the saved design"
      ],
      "strapline": "We outline wear schedules and review points based on your activity."
    },
    {
      "instanceId": "3d-mouth-guards-technology",
      "componentId": "treatment.technology",
      "variantId": "smh_3d_mouth_guards_technology",
      "order": 60,
      "seoRole": "supporting",
      "eyebrow": "Technology",
      "title": "Scans and calibrated printing for consistent fit",
      "body": "Accurate scans and calibrated printers help us build guards that seat comfortably and stay secure while you train or sleep."
    },
    {
      "instanceId": "3d-mouth-guards-aftercare",
      "componentId": "treatment.aftercareRisks",
      "variantId": "smh_3d_mouth_guards_aftercare",
      "order": 70,
      "seoRole": "supporting",
      "eyebrow": "Aftercare & considerations",
      "title": "Keep your guard performing well",
      "items": [
        "Rinse after use and clean with recommended solutions",
        "Store in the provided case away from heat",
        "Bring the guard to reviews for fit checks",
        "Let us know about cracks or bite changes early",
        "Reprints available from your stored scan if needed"
      ]
    },
    {
      "instanceId": "3d-mouth-guards-faq",
      "componentId": "treatment.faq",
      "variantId": "smh_3d_mouth_guards_faq",
      "order": 80,
      "seoRole": "faq",
      "eyebrow": "Guard FAQs",
      "title": "Answers before you decide",
      "faqs": [
        {
          "question": "How long do 3D mouth guards last?",
          "answer": "Lifespan depends on usage and bite forces. We outline expected replacement cycles and review fit at check-ups."
        },
        {
          "question": "Can I get a backup guard?",
          "answer": "Yes. Once your design is approved, we can print a spare from the same file for travel or training."
        },
        {
          "question": "Are they suitable for heavy grinding?",
          "answer": "We select thickness and materials based on your grinding pattern and may suggest specific wear schedules to protect the guard and your teeth."
        },
        {
          "question": "Will the guard affect speech?",
          "answer": "There may be short-term adaptation. We aim for a slim profile and smooth edges to keep speech clear once you adjust."
        },
        {
          "question": "What if my bite changes?",
          "answer": "Bring the guard to your review. We can assess and reprint or adjust using your stored scan so the fit remains comfortable."
        }
      ]
    },
    {
      "instanceId": "3d-mouth-guards-cta",
      "componentId": "treatment.cta",
      "variantId": "smh_3d_mouth_guards_cta",
      "order": 90,
      "seoRole": "cta",
      "eyebrow": "Next steps",
      "title": "Get a comfortable, protective guard",
      "body": "Book a calm consultation to plan a 3D printed guard tailored to your sport or night-time needs.",
      "ctas": [
        { "label": "Book a guard consult", "href": "/contact", "preset": "primary" },
        { "label": "Ask about 3D guards", "href": "/contact?topic=3d-printing", "preset": "secondary" }
      ]
    }
  ]
}
