{
  "tenantId": "smh-dental",
  "routeId": "treatments.extractions-and-oral-surgery",
  "pageType": "treatment",
  "version": "1.0.0",
  "sections": [
    {
      "instanceId": "extractions-oral-surgery-hero",
      "componentId": "treatment.heroIntro",
      "variantId": "smh_extractions_oral_surgery_hero",
      "order": 10,
      "seoRole": "hero",
      "eyebrow": "Extractions & oral surgery",
      "title": "Gentle extractions with clear surgical planning",
      "body": "When a tooth can’t be saved, we remove it with care, protect surrounding tissue, and guide you through healing and replacement options.",
      "bullets": [
        "Calm assessments that explain when extraction is the safest route",
        "Minimally invasive techniques to protect bone and gum",
        "Aftercare and future planning for implants, bridges, or dentures"
      ],
      "ctas": [
        { "label": "Book an extraction assessment", "href": "/contact", "preset": "primary" },
        { "label": "Ask about oral surgery", "href": "/contact?topic=treatment", "preset": "secondary" }
      ]
    },
    {
      "instanceId": "extractions-oral-surgery-symptoms",
      "componentId": "treatment.whoIsItFor",
      "variantId": "smh_extractions_oral_surgery_symptoms",
      "order": 20,
      "seoRole": "primaryContent",
      "eyebrow": "When removal is considered",
      "title": "Situations that may need extraction or surgery",
      "items": [
        "Severe decay or fracture where a filling or crown cannot seal the tooth",
        "Persistent infection after root canal or structural cracks to the root",
        "Impacted or problematic wisdom teeth causing pain or crowding",
        "Advanced gum disease with loose, uncomfortable teeth",
        "Orthodontic or prosthetic planning where space or stability is needed"
      ],
      "strapline": "If you experience rapid swelling, spreading infection, or difficulty swallowing, treat it as urgent and contact us for emergency dentistry advice."
    },
    {
      "instanceId": "extractions-oral-surgery-options",
      "componentId": "treatment.trustSignals",
      "variantId": "smh_extractions_oral_surgery_options",
      "order": 25,
      "seoRole": "primaryContent",
      "eyebrow": "Options within this hub",
      "title": "Plan the safest removal and next steps",
      "items": [
        "Emergency relief and assessment if pain or infection is acute (/treatments/emergency-dentistry)",
        "Simple or surgical extraction with clear aftercare (/treatments/extractions-and-oral-surgery)",
        "Socket preservation or grafting when future implants are planned (/treatments/implants-bone-grafting)",
        "Healing and replacement pathways including bridges, dentures, or implants (/treatments/implants)"
      ]
    },
    {
      "instanceId": "extractions-oral-surgery-process",
      "componentId": "treatment.processTimeline",
      "variantId": "smh_extractions_oral_surgery_process",
      "order": 30,
      "seoRole": "primaryContent",
      "eyebrow": "How the procedure works",
      "title": "Planned steps for predictable healing",
      "items": [
        "Assessment: X-rays or CBCT to map roots, nerves, and sinus position",
        "Comfort: Local anaesthetic and gentle explanation before we begin",
        "Access: Precise gum and bone access only where needed",
        "Removal: Sectioning or elevation to ease the tooth out with minimal force",
        "Site care: Thorough cleaning, possible grafting, and careful suturing",
        "Instructions: Clear guidance on rest, cleaning, and what to expect during healing",
        "Review: Follow-up to confirm the site is settling and discuss next steps"
      ]
    },
    {
      "instanceId": "extractions-oral-surgery-technology",
      "componentId": "treatment.technology",
      "variantId": "smh_extractions_oral_surgery_technology",
      "order": 40,
      "seoRole": "supporting",
      "eyebrow": "Technology & precision",
      "title": "Digital planning that protects nearby structures",
      "body": "CBCT imaging, surgical planning, and fine instruments help us visualise roots, nerves, and sinus spaces so we can work accurately and reduce trauma.",
      "mediaHint": "CBCT-guided planning and minimally invasive instruments"
    },
    {
      "instanceId": "extractions-oral-surgery-comfort",
      "componentId": "treatment.aftercareRisks",
      "variantId": "smh_extractions_oral_surgery_comfort",
      "order": 50,
      "seoRole": "supporting",
      "eyebrow": "Comfort, anxiety & aftercare",
      "title": "Support from anaesthetic to healing",
      "items": [
        "Local anaesthetic for comfort; sedation dentistry can be discussed for anxious patients",
        "Measured technique to limit swelling and bruising",
        "Guidance on pain relief, rest, and eating while the site heals",
        "Instructions to keep the area clean without disturbing the socket",
        "Direct contact if bleeding, swelling, or discomfort changes unexpectedly"
      ]
    },
    {
      "instanceId": "extractions-oral-surgery-risks",
      "componentId": "treatment.consultationOverview",
      "variantId": "smh_extractions_oral_surgery_risks",
      "order": 60,
      "seoRole": "supporting",
      "eyebrow": "Risks, limits & alternatives",
      "title": "Transparent guidance before removal",
      "body": "We outline potential risks such as dry socket, sinus communication, nerve proximity, or the need for sectioning so you know what to expect. Where a tooth might be saved with restorative care, we will explain that option too.",
      "bullets": [
        "Discussion of saving versus removing a tooth with restorative or endodontic care",
        "Clear consent for complex roots, impacted teeth, or medical considerations",
        "Alternatives such as monitoring or referral to surgical colleagues when indicated",
        "Planning for provisional solutions while you heal"
      ]
    },
    {
      "instanceId": "extractions-oral-surgery-prognosis",
      "componentId": "treatment.consultationOverview",
      "variantId": "smh_extractions_oral_surgery_prognosis",
      "order": 70,
      "seoRole": "supporting",
      "eyebrow": "Longevity & what comes next",
      "title": "Stable healing and future options",
      "body": "With careful socket care, most sites heal smoothly in a few weeks. We guide you on timing for implants, bridges, or dentures so you know when replacement can safely begin.",
      "bullets": [
        "Monitoring to confirm bone and gum health before replacement",
        "Advice on protecting the site to maintain bone volume",
        "Discussion of implant planning or bridgework once healing allows",
        "Ongoing reviews to keep surrounding teeth and gums healthy"
      ]
    },
    {
      "instanceId": "extractions-oral-surgery-faq",
      "componentId": "treatment.faq",
      "variantId": "smh_extractions_oral_surgery_faq",
      "order": 80,
      "seoRole": "faq",
      "eyebrow": "Extraction & surgery FAQs",
      "title": "Answers to common questions",
      "faqs": [
        {
          "question": "Will I feel pain during the extraction?",
          "answer": "The area is numbed thoroughly with local anaesthetic. You may feel pressure but should not feel sharp pain, and sedation options can be discussed if you are anxious."
        },
        {
          "question": "How long is recovery?",
          "answer": "Most people are comfortable after a few days with steady improvement over 1–2 weeks. We give written instructions to support smooth healing."
        },
        {
          "question": "Can the tooth be replaced?",
          "answer": "Yes. We will discuss timing for implants, bridges, or dentures once the area is stable, and we can provide provisional solutions if needed."
        },
        {
          "question": "What if the tooth could be saved?",
          "answer": "If a filling, crown, or root canal could provide a predictable result, we’ll explain that option first so you can make an informed choice."
        }
      ]
    },
    {
      "instanceId": "extractions-oral-surgery-cta",
      "componentId": "treatment.cta",
      "variantId": "smh_extractions_oral_surgery_cta",
      "order": 90,
      "seoRole": "cta",
      "eyebrow": "Next steps",
      "title": "Need advice about a troublesome tooth?",
      "body": "We’ll review your options, plan comfortable removal if needed, and map the best path to restore your smile.",
      "ctas": [
        { "label": "Book an oral surgery consult", "href": "/contact", "variant": "primary" },
        { "label": "Call the team", "href": "/contact", "variant": "secondary" }
      ]
    }
  ]
}
